{
 "schema_version": 2,
 "sql": "sql/01_region_population_growth.sql",
 "processed_utc": "2026-10-22T21:13:03.921268+00:00",
 "input_mode": "snapshot",
 "rows": [
  {
   "region": "auckland",
   "year": 2018,
   "pop": 1654800.0,
   "previous_year": 2017,
   "cagr_start_year": 2013,
   "cagr_end_year": 2018,
   "yoy_growth_pct": null,
   "cagr5_pct": null,
   "pop_gain_5yr": null
  },
  {
   "region": "auckland",
   "year": 2019,
   "pop": 1680500.0,
   "previous_year": 2018,
   "cagr_start_year": 2014,
   "cagr_end_year": 2019,
   "yoy_growth_pct": 1.5530577713318783,
   "cagr5_pct": null,
   "pop_gain_5yr": null
  },
  {
   "region": "auckland",
   "year": 2020,
   "pop": 1712000.0,
   "previous_year": 2019,
   "cagr_start_year": 2015,
   "cagr_end_year": 2020,
   "yoy_growth_pct": 1.8744421303183545,
   "cagr5_pct": null,
   "pop_gain_5yr": null
  },
  {
   "region": "auckland",
   "year": 2021,
   "pop": 1704000.0,
   "previous_year": 2020,
   "cagr_start_year": 2016,
   "cagr_end_year": 2021,
   "yoy_growth_pct": -0.4672897196261627,
   "cagr5_pct": null,
   "pop_gain_5yr": null
  },
  {
   "region": "auckland",
   "year": 2022,
   "pop": 1694400.0,
   "previous_year": 2021,
   "cagr_start_year": 2017,
   "cagr_end_year": 2022,
   "yoy_growth_pct": -0.5633802816901401,
   "cagr5_pct": null,
   "pop_gain_5yr": null
  },
  {
   "region": "auckland",
   "year": 2023,
   "pop": 1755200.0,
   "previous_year": 2022,
   "cagr_start_year": 2018,
   "cagr_end_year": 2023,
   "yoy_growth_pct": 3.5882908404154756,
   "cagr5_pct": 1.1850194731776176,
   "pop_gain_5yr": 100400.0
  },
  {
   "region": "auckland",
   "year": 2024,
   "pop": 1798300.0,
   "previous_year": 2023,
   "cagr_start_year": 2019,
   "cagr_end_year": 2024,
   "yoy_growth_pct": 2.4555606198723767,
   "cagr5_pct": 1.3642299603005004,
   "pop_gain_5yr": 117800.0
  },
  {
   "region": "auckland",
   "year": 2025,
   "pop": 1816000.0,
   "previous_year": 2024,
   "cagr_start_year": 2020,
   "cagr_end_year": 2025,
   "yoy_growth_pct": 0.9842629149752646,
   "cagr5_pct": 1.1864633436375893,
   "pop_gain_5yr": 104000.0
  },
  {
   "region": "canterbury",
   "year": 2018,
   "pop": 622800.0,
   "previous_year": 2017,
   "cagr_start_year": 2013,
   "cagr_end_year": 2018,
   "yoy_growth_pct": null,
   "cagr5_pct": null,
   "pop_gain_5yr": null
  },
  {
   "region": "canterbury",
   "year": 2019,
   "pop": 632000.0,
   "previous_year": 2018,
   "cagr_start_year": 2014,
   "cagr_end_year": 2019,
   "yoy_growth_pct": 1.477199743095703,
   "cagr5_pct": null,
   "pop_gain_5yr": null
  },
  {
   "region": "canterbury",
   "year": 2020,
   "pop": 645900.0,
   "previous_year": 2019,
   "cagr_start_year": 2015,
   "cagr_end_year": 2020,
   "yoy_growth_pct": 2.1993670886075956,
   "cagr5_pct": null,
   "pop_gain_5yr": null
  },
  {
   "region": "canterbury",
   "year": 2021,
   "pop": 652600.0,
   "previous_year": 2020,
   "cagr_start_year": 2016,
   "cagr_end_year": 2021,
   "yoy_growth_pct": 1.037312277442326,
   "cagr5_pct": null,
   "pop_gain_5yr": null
  },
  {
   "region": "canterbury",
   "year": 2022,
   "pop": 658300.0,
   "previous_year": 2021,
   "cagr_start_year": 2017,
   "cagr_end_year": 2022,
   "yoy_growth_pct": 0.8734293594851339,
   "cagr5_pct": null,
   "pop_gain_5yr": null
  },
  {
   "region": "canterbury",
   "year": 2023,
   "pop": 676600.0,
   "previous_year": 2022,
   "cagr_start_year": 2018,
   "cagr_end_year": 2023,
   "yoy_growth_pct": 2.7798875892450337,
   "cagr5_pct": 1.670902323055401,
   "pop_gain_5yr": 53800.0
  },
  {
   "region": "canterbury",
   "year": 2024,
   "pop": 690600.0,
   "previous_year": 2023,
   "cagr_start_year": 2019,
   "cagr_end_year": 2024,
   "yoy_growth_pct": 2.069169376293223,
   "cagr5_pct": 1.7892464194217972,
   "pop_gain_5yr": 58600.0
  },
  {
   "region": "canterbury",
   "year": 2025,
   "pop": 698200.0,
   "previous_year": 2024,
   "cagr_start_year": 2020,
   "cagr_end_year": 2025,
   "yoy_growth_pct": 1.1004923255140353,
   "cagr5_pct": 1.5694058541263045,
   "pop_gain_5yr": 52300.0
  },
  {
   "region": "hawkes_bay",
   "year": 2018,
   "pop": 172400.0,
   "previous_year": 2017,
   "cagr_start_year": 2013,
   "cagr_end_year": 2018,
   "yoy_growth_pct": null,
   "cagr5_pct": null,
   "pop_gain_5yr": null
  },
  {
   "region": "hawkes_bay",
   "year": 2019,
   "pop": 173800.0,
   "previous_year": 2018,
   "cagr_start_year": 2014,
   "cagr_end_year": 2019,
   "yoy_growth_pct": 0.8120649651972123,
   "cagr5_pct": null,
   "pop_gain_5yr": null
  },
  {
   "region": "hawkes_bay",
   "year": 2020,
   "pop": 177700.0,
   "previous_year": 2019,
   "cagr_start_year": 2015,
   "cagr_end_year": 2020,
   "yoy_growth_pct": 2.243958573072491,
   "cagr5_pct": null,
   "pop_gain_5yr": null
  },
  {
   "region": "hawkes_bay",
   "year": 2021,
   "pop": 178500.0,
   "previous_year": 2020,
   "cagr_start_year": 2016,
   "cagr_end_year": 2021,
   "yoy_growth_pct": 0.45019696117050145,
   "cagr5_pct": null,
   "pop_gain_5yr": null
  },
  {
   "region": "hawkes_bay",
   "year": 2022,
   "pop": 177700.0,
   "previous_year": 2021,
   "cagr_start_year": 2017,
   "cagr_end_year": 2022,
   "yoy_growth_pct": -0.4481792717086819,
   "cagr5_pct": null,
   "pop_gain_5yr": null
  },
  {
   "region": "hawkes_bay",
   "year": 2023,
   "pop": 179000.0,
   "previous_year": 2022,
   "cagr_start_year": 2018,
   "cagr_end_year": 2023,
   "yoy_growth_pct": 0.731570061902076,
   "cagr5_pct": 0.7541988118572762,
   "pop_gain_5yr": 6600.0
  },
  {
   "region": "hawkes_bay",
   "year": 2024,
   "pop": 179800.0,
   "previous_year": 2023,
   "cagr_start_year": 2019,
   "cagr_end_year": 2024,
   "yoy_growth_pct": 0.4469273743016755,
   "cagr5_pct": 0.6811072406529561,
   "pop_gain_5yr": 6000.0
  },
  {
   "region": "hawkes_bay",
   "year": 2025,
   "pop": 179700.0,
   "previous_year": 2024,
   "cagr_start_year": 2020,
   "cagr_end_year": 2025,
   "yoy_growth_pct": -0.05561735261401246,
   "cagr5_pct": 0.22409188396106394,
   "pop_gain_5yr": 2000.0
  },
  {
   "region": "otago",
   "year": 2018,
   "pop": 235000.0,
   "previous_year": 2017,
   "cagr_start_year": 2013,
   "cagr_end_year": 2018,
   "yoy_growth_pct": null,
   "cagr5_pct": null,
   "pop_gain_5yr": null
  },
  {
   "region": "otago",
   "year": 2019,
   "pop": 238400.0,
   "previous_year": 2018,
   "cagr_start_year": 2014,
   "cagr_end_year": 2019,
   "yoy_growth_pct": 1.4468085106382977,
   "cagr5_pct": null,
   "pop_gain_5yr": null
  },
  {
   "region": "otago",
   "year": 2020,
   "pop": 244000.0,
   "previous_year": 2019,
   "cagr_start_year": 2015,
   "cagr_end_year": 2020,
   "yoy_growth_pct": 2.348993288590595,
   "cagr5_pct": null,
   "pop_gain_5yr": null
  },
  {
   "region": "otago",
   "year": 2021,
   "pop": 243400.0,
   "previous_year": 2020,
   "cagr_start_year": 2016,
   "cagr_end_year": 2021,
   "yoy_growth_pct": -0.24590163934425924,
   "cagr5_pct": null,
   "pop_gain_5yr": null
  },
  {
   "region": "otago",
   "year": 2022,
   "pop": 243400.0,
   "previous_year": 2021,
   "cagr_start_year": 2017,
   "cagr_end_year": 2022,
   "yoy_growth_pct": 0.0,
   "cagr5_pct": null,
   "pop_gain_5yr": null
  },
  {
   "region": "otago",
   "year": 2023,
   "pop": 248500.0,
   "previous_year": 2022,
   "cagr_start_year": 2018,
   "cagr_end_year": 2023,
   "yoy_growth_pct": 2.095316351684473,
   "cagr5_pct": 1.1234100127927915,
   "pop_gain_5yr": 13500.0
  },
  {
   "region": "otago",
   "year": 2024,
   "pop": 252400.0,
   "previous_year": 2023,
   "cagr_start_year": 2019,
   "cagr_end_year": 2024,
   "yoy_growth_pct": 1.5694164989939585,
   "cagr5_pct": 1.1478416306691885,
   "pop_gain_5yr": 14000.0
  },
  {
   "region": "otago",
   "year": 2025,
   "pop": 253900.0,
   "previous_year": 2024,
   "cagr_start_year": 2020,
   "cagr_end_year": 2025,
   "yoy_growth_pct": 0.5942947702060275,
   "cagr5_pct": 0.7986173393413454,
   "pop_gain_5yr": 9900.0
  },
  {
   "region": "southland",
   "year": 2018,
   "pop": 100500.0,
   "previous_year": 2017,
   "cagr_start_year": 2013,
   "cagr_end_year": 2018,
   "yoy_growth_pct": null,
   "cagr5_pct": null,
   "pop_gain_5yr": null
  },
  {
   "region": "southland",
   "year": 2019,
   "pop": 101400.0,
   "previous_year": 2018,
   "cagr_start_year": 2014,
   "cagr_end_year": 2019,
   "yoy_growth_pct": 0.8955223880596996,
   "cagr5_pct": null,
   "pop_gain_5yr": null
  },
  {
   "region": "southland",
   "year": 2020,
   "pop": 102200.0,
   "previous_year": 2019,
   "cagr_start_year": 2015,
   "cagr_end_year": 2020,
   "yoy_growth_pct": 0.7889546351084853,
   "cagr5_pct": null,
   "pop_gain_5yr": null
  },
  {
   "region": "southland",
   "year": 2021,
   "pop": 101400.0,
   "previous_year": 2020,
   "cagr_start_year": 2016,
   "cagr_end_year": 2021,
   "yoy_growth_pct": -0.7827788649706457,
   "cagr5_pct": null,
   "pop_gain_5yr": null
  },
  {
   "region": "southland",
   "year": 2022,
   "pop": 101000.0,
   "previous_year": 2021,
   "cagr_start_year": 2017,
   "cagr_end_year": 2022,
   "yoy_growth_pct": -0.39447731755424265,
   "cagr5_pct": null,
   "pop_gain_5yr": null
  },
  {
   "region": "southland",
   "year": 2023,
   "pop": 102700.0,
   "previous_year": 2022,
   "cagr_start_year": 2018,
   "cagr_end_year": 2023,
   "yoy_growth_pct": 1.6831683168316847,
   "cagr5_pct": 0.43402696920715744,
   "pop_gain_5yr": 2200.0
  },
  {
   "region": "southland",
   "year": 2024,
   "pop": 104200.0,
   "previous_year": 2023,
   "cagr_start_year": 2019,
   "cagr_end_year": 2024,
   "yoy_growth_pct": 1.4605647517039966,
   "cagr5_pct": 0.5462673920402228,
   "pop_gain_5yr": 2800.0
  },
  {
   "region": "southland",
   "year": 2025,
   "pop": 104800.0,
   "previous_year": 2024,
   "cagr_start_year": 2020,
   "cagr_end_year": 2025,
   "yoy_growth_pct": 0.5758157389635254,
   "cagr5_pct": 0.5037062382367008,
   "pop_gain_5yr": 2600.0
  },
  {
   "region": "waikato",
   "year": 2018,
   "pop": 475600.0,
   "previous_year": 2017,
   "cagr_start_year": 2013,